<?xml version="1.0" encoding="UTF-8"?>
<unit:unit
	xmlns:xsi="http://www.w3.org/2001/XMLSchema-instance"
	xsi:schemaLocation="http://easykit.informatik.tu-muenchen.de/schema/unit unit.xsd"
	xmlns:plugin="http://easykit.informatik.tu-muenchen.de/schema/plugin"
	xmlns:unit="http://easykit.informatik.tu-muenchen.de/schema/unit"
	xmlns:var="http://easykit.informatik.tu-muenchen.de/schema/variable"
	xmlns:tmpl="http://easykit.informatik.tu-muenchen.de/schema/template"
	xmlns:tr="http://easykit.informatik.tu-muenchen.de/schema/translation">

	<unit:translations>
	</unit:translations>

	<unit:unittypes>

		<unit:unittype unit:id="REC GmbH Value Reader">
			<unit:typeTemplates/>
			<unit:connectors>
				<unit:in>
					<unit:connector var:type="bool" var:varname="enable">
						<var:default var:val="true"/>
					</unit:connector>
					<unit:connector var:type="string" var:varname="file">
						<var:default var:val=""/>
					</unit:connector>
				</unit:in>
				<unit:out>
          <unit:connector var:type="floatvector" var:varname="output">
            <var:default var:val=""/>
          </unit:connector>
				</unit:out>
			</unit:connectors>
			<unit:state>
				<unit:statevar var:type="int16" var:varname="step">
					<var:default var:val="0"/>
				</unit:statevar>
        <unit:statevar var:type="bool" var:varname="running">
          <var:default var:val="false"/>
        </unit:statevar>
			</unit:state>

			<unit:guiinfo>
				<unit:connectors>
					<unit:in>
						<unit:layout unit:varname="enable" unit:side="left"/>
            <unit:layout unit:varname="file" unit:side="left" unit:display="hidden"/>
					</unit:in>
					<unit:out>
            <unit:layout unit:varname="output" unit:side="right"/>
          </unit:out>
				</unit:connectors>
				<unit:state>
				</unit:state>

				<unit:description>
					<unit:name>Value reader</unit:name>
					<unit:icon unit:filename="icons/valuereader.png"/>
					<unit:connectors>
						<unit:in>
							<unit:info unit:varname="enable">
								<unit:description>Enable</unit:description>
							</unit:info>
							<unit:info unit:varname="file">
								<unit:description>File</unit:description>
							</unit:info>
						</unit:in>
						<unit:out>
              <unit:info unit:varname="output">
                <unit:description>Output</unit:description>
              </unit:info>
						</unit:out>
					</unit:connectors>
					<unit:state>
						<unit:info unit:varname="step">
							<unit:description>step</unit:description>
						</unit:info>
					</unit:state>
				</unit:description>
			</unit:guiinfo>

			<unit:plugins>
				<unit:plugin plugin:type="simulation" plugin:library="unit_robview_dataexchange_valuereader_simulation"/>
				<unit:plugin plugin:type="dialog" plugin:library="unit_robview_dataexchange_valuereader_gui"/>
			</unit:plugins>
		</unit:unittype>
	</unit:unittypes>
</unit:unit>
		
