<?xml version="1.0" encoding="UTF-8"?>
<unit:unit
	xmlns:xsi="http://www.w3.org/2001/XMLSchema-instance"
	xsi:schemaLocation="http://easykit.informatik.tu-muenchen.de/schema/unit unit.xsd"
	xmlns:plugin="http://easykit.informatik.tu-muenchen.de/schema/plugin"
	xmlns:unit="http://easykit.informatik.tu-muenchen.de/schema/unit"
	xmlns:var="http://easykit.informatik.tu-muenchen.de/schema/variable"
	xmlns:tmpl="http://easykit.informatik.tu-muenchen.de/schema/template"
	xmlns:tr="http://easykit.informatik.tu-muenchen.de/schema/translation">

	<unit:translations>
	</unit:translations>

	<unit:unittypes>

		<unit:unittype unit:id="REC GmbH ROI">
			<unit:typeTemplates/>
			<unit:connectors>
				<unit:in>
					<unit:connector var:type="image" var:varname="source">
						<var:default var:val=""/>
					</unit:connector>
					<unit:connector var:type="roi" var:varname="roi" >
						<var:default var:val=""/>
					</unit:connector>
				</unit:in>
				<unit:out>
					<unit:connector var:type="image" var:varname="dest">
						<var:default var:val=""/>
					</unit:connector>
				</unit:out>
			</unit:connectors>
			<unit:state>
			</unit:state>

			<unit:guiinfo>
				<unit:connectors>
					<unit:in>
						<unit:layout unit:varname="source" unit:side="left"/>
						<unit:layout unit:varname="roi" unit:side="left" unit:display="hidden"/>
					</unit:in>
					<unit:out>
						<unit:layout unit:varname="dest" unit:side="right"/>
					</unit:out>
				</unit:connectors>
				<unit:state>
				</unit:state>

				<unit:description>
					<unit:name>ROI</unit:name>
					<unit:icon unit:filename="icons/roi.png"/>
					<unit:connectors>
						<unit:in>
							<unit:info unit:varname="source">
								<unit:description>Input</unit:description>
							</unit:info>
							<unit:info unit:varname="roi">
								<unit:description>ROI</unit:description>
							</unit:info>
						</unit:in>
						<unit:out>
							<unit:info unit:varname="dest">
								<unit:description>Output</unit:description>
							</unit:info>
						</unit:out>
					</unit:connectors>
					<unit:state>
					</unit:state>
				</unit:description>
			</unit:guiinfo>

			<unit:plugins>
				<unit:plugin plugin:type="simulation" plugin:library="unit_robview_imageprocessing_roi_simulation"/>
				<unit:plugin plugin:type="dialog" plugin:library="unit_robview_imageprocessing_roi_gui"/>
			</unit:plugins>
		</unit:unittype>
	</unit:unittypes>
</unit:unit>
		