<?xml version="1.0" encoding="UTF-8"?>
<unit:unit
	xmlns:xsi="http://www.w3.org/2001/XMLSchema-instance"
	xsi:schemaLocation="http://easykit.informatik.tu-muenchen.de/schema/unit unit.xsd"
	xmlns:plugin="http://easykit.informatik.tu-muenchen.de/schema/plugin"
	xmlns:unit="http://easykit.informatik.tu-muenchen.de/schema/unit"
	xmlns:var="http://easykit.informatik.tu-muenchen.de/schema/variable"
	xmlns:tmpl="http://easykit.informatik.tu-muenchen.de/schema/template"
	xmlns:tr="http://easykit.informatik.tu-muenchen.de/schema/translation">

	<unit:translations>
	</unit:translations>

	<unit:unittypes>
		<unit:unittype unit:id="REC GmbH Basic Addition">
			<unit:typeTemplates/>
			<unit:connectors>
				<unit:in>
					<unit:connector var:type="float" var:varname="s1">
						<var:default var:val="0" />
					</unit:connector>
					<unit:connector var:type="float" var:varname="s2">
						<var:default var:val="0" />
					</unit:connector>
					<unit:connector var:type="float" var:varname="s3">
						<var:default var:val="0" />
					</unit:connector>
					<unit:connector var:type="float" var:varname="s4">
						<var:default var:val="0" />
					</unit:connector>
					<unit:connector var:type="float" var:varname="s5">
						<var:default var:val="0" />
					</unit:connector>
					<unit:connector var:type="float" var:varname="s6">
						<var:default var:val="0" />
					</unit:connector>
					<unit:connector var:type="float" var:varname="s7">
						<var:default var:val="0" />
					</unit:connector>
					<unit:connector var:type="float" var:varname="s8">
						<var:default var:val="0" />
					</unit:connector>
					<unit:connector var:type="float" var:varname="s9">
						<var:default var:val="0" />
					</unit:connector>
					<unit:connector var:type="float" var:varname="s10">
						<var:default var:val="0" />
					</unit:connector>
				</unit:in>
				<unit:out>
					<unit:connector var:type="float" var:varname="sum">
						<var:default var:val="0" />
					</unit:connector>
				</unit:out>
			</unit:connectors>
			<unit:state/>

			<unit:guiinfo>
				<unit:connectors>
					<unit:in>
						<unit:layout unit:varname="s1" unit:side="left"/>
						<unit:layout unit:varname="s2" unit:side="left"/>
						<unit:layout unit:varname="s3" unit:side="left" unit:display="hidden"/>
						<unit:layout unit:varname="s4" unit:side="left" unit:display="hidden"/>
						<unit:layout unit:varname="s5" unit:side="left" unit:display="hidden"/>
						<unit:layout unit:varname="s6" unit:side="left" unit:display="hidden"/>
						<unit:layout unit:varname="s7" unit:side="left" unit:display="hidden"/>
						<unit:layout unit:varname="s8" unit:side="left" unit:display="hidden"/>
						<unit:layout unit:varname="s9" unit:side="left" unit:display="hidden"/>
						<unit:layout unit:varname="s10" unit:side="left" unit:display="hidden"/>
					</unit:in>
					<unit:out>
						<unit:layout unit:varname="sum" unit:side="right"/>
					</unit:out>
				</unit:connectors>
				<unit:state/>

				<unit:description>
					<unit:name>Addition</unit:name>
					<unit:icon unit:filename="add.png"/>
					<unit:connectors>
						<unit:in>
							<unit:info unit:varname="s1">
								<unit:description>Summand[ 1]</unit:description>
							</unit:info>
							<unit:info unit:varname="s2">
								<unit:description>Summand[ 2]</unit:description>
							</unit:info>
							<unit:info unit:varname="s3">
								<unit:description>Summand[ 3]</unit:description>
							</unit:info>
							<unit:info unit:varname="s4">
								<unit:description>Summand[ 4]</unit:description>
							</unit:info>
							<unit:info unit:varname="s5">
								<unit:description>Summand[ 5]</unit:description>
							</unit:info>
							<unit:info unit:varname="s6">
								<unit:description>Summand[ 6]</unit:description>
							</unit:info>
							<unit:info unit:varname="s7">
								<unit:description>Summand[ 7]</unit:description>
							</unit:info>
							<unit:info unit:varname="s8">
								<unit:description>Summand[ 8]</unit:description>
							</unit:info>
							<unit:info unit:varname="s9">
								<unit:description>Summand[ 9]</unit:description>
							</unit:info>
							<unit:info unit:varname="s10">
								<unit:description>Summand[ 10]</unit:description>
							</unit:info>
						</unit:in>
						<unit:out>
							<unit:info unit:varname="sum">
								<unit:description>Sum</unit:description>
							</unit:info>
						</unit:out>
					</unit:connectors>
					<unit:state/>
				</unit:description>
			</unit:guiinfo>

			<unit:plugins>
				<unit:plugin plugin:type="simulation" plugin:library="unit_robview_math_addition_simulation"/>
				<unit:plugin plugin:type="dialog" plugin:library="unit_robview_math_addition_gui"/>
			</unit:plugins>
			
		</unit:unittype>
	</unit:unittypes>
</unit:unit>
