<?xml version="1.0" encoding="UTF-8"?>
<unit:unit
	xmlns:xsi="http://www.w3.org/2001/XMLSchema-instance"
	xsi:schemaLocation="http://easykit.informatik.tu-muenchen.de/schema/unit unit.xsd"
	xmlns:plugin="http://easykit.informatik.tu-muenchen.de/schema/plugin"
	xmlns:unit="http://easykit.informatik.tu-muenchen.de/schema/unit"
	xmlns:var="http://easykit.informatik.tu-muenchen.de/schema/variable"
	xmlns:tmpl="http://easykit.informatik.tu-muenchen.de/schema/template"
	xmlns:tr="http://easykit.informatik.tu-muenchen.de/schema/translation">

	<unit:translations>
	</unit:translations>

	<unit:unittypes>

		<unit:unittype unit:id="REC GmbH Pose Composer">
			<unit:typeTemplates/>
			<unit:connectors>
				<unit:in>
					<unit:connector var:type="float" var:varname="x">
						<var:default var:val="0"/>
					</unit:connector>
					<unit:connector var:type="float" var:varname="y">
						<var:default var:val="0"/>
					</unit:connector>
					<unit:connector var:type="float" var:varname="phi">
						<var:default var:val="0"/>
					</unit:connector>
					<unit:connector var:type="bool" var:varname="pose_valid">
						<var:default var:val="true"/>
					</unit:connector>
					<unit:connector var:type="bool" var:varname="orientation_valid">
						<var:default var:val="true"/>
					</unit:connector>
					<unit:connector var:type="bool" var:varname="orientation_radians">
						<var:default var:val="false"/>
					</unit:connector>
				</unit:in>
				<unit:out>
					<unit:connector var:type="pose" var:varname="pose">
						<var:default var:val=""/>
					</unit:connector>
				</unit:out>
			</unit:connectors>
			<unit:state>
			</unit:state>

			<unit:guiinfo>
				<unit:connectors>
					<unit:in>
						<unit:layout unit:varname="x" unit:side="left"/>
						<unit:layout unit:varname="y" unit:side="left"/>
						<unit:layout unit:varname="phi" unit:side="left"/>
						<unit:layout unit:varname="pose_valid" unit:side="left" unit:display="hidden"/>
						<unit:layout unit:varname="orientation_valid" unit:side="left" unit:display="hidden"/>
						<unit:layout unit:varname="orientation_radians" unit:side="left" unit:display="hidden"/>
					</unit:in>
					<unit:out>
						<unit:layout unit:varname="pose" unit:side="right"/>
					</unit:out>
				</unit:connectors>
				<unit:state>
				</unit:state>

				<unit:description>
					<unit:name>Pose composer</unit:name>
					<unit:icon unit:filename="icons/icon.png"/>
					<unit:connectors>
						<unit:in>
							<unit:info unit:varname="x">
								<unit:description>x</unit:description>
							</unit:info>
							<unit:info unit:varname="y">
								<unit:description>y</unit:description>
							</unit:info>
							<unit:info unit:varname="phi">
								<unit:description>phi</unit:description>
							</unit:info>
							<unit:info unit:varname="pose_valid">
								<unit:description>Pose valid</unit:description>
							</unit:info>
							<unit:info unit:varname="orientation_valid">
								<unit:description>Orientation valid</unit:description>
							</unit:info>
							<unit:info unit:varname="orientation_radians">
								<unit:description>Orientation in radians</unit:description>
							</unit:info>
						</unit:in>
						<unit:out>
							<unit:info unit:varname="pose">
								<unit:description>Pose</unit:description>
							</unit:info>
						</unit:out>
					</unit:connectors>
					<unit:state>
					</unit:state>
				</unit:description>
			</unit:guiinfo>

			<unit:plugins>
				<unit:plugin plugin:type="simulation" plugin:library="unit_robview_navigation_pose_composer_simulation"/>
				<unit:plugin plugin:type="dialog" plugin:library="unit_robview_navigation_pose_composer_gui"/>
			</unit:plugins>

			<unit:codegen/>
		</unit:unittype>
	</unit:unittypes>
</unit:unit>

