<?xml version="1.0" encoding="UTF-8"?>
<unit:unit
	xmlns:xsi="http://www.w3.org/2001/XMLSchema-instance"
	xsi:schemaLocation="http://easykit.informatik.tu-muenchen.de/schema/unit unit.xsd"
	xmlns:plugin="http://easykit.informatik.tu-muenchen.de/schema/plugin"
	xmlns:unit="http://easykit.informatik.tu-muenchen.de/schema/unit"
	xmlns:var="http://easykit.informatik.tu-muenchen.de/schema/variable"
	xmlns:tmpl="http://easykit.informatik.tu-muenchen.de/schema/template"
	xmlns:tr="http://easykit.informatik.tu-muenchen.de/schema/translation">

	<unit:translations>
	</unit:translations>

	<unit:unittypes>

		<unit:unittype unit:id="REC GmbH Position View">
			<unit:typeTemplates/>
			<unit:connectors>
				<unit:in>
					<unit:connector var:type="float" var:varname="xactual">
						<var:default var:val="0"/>
					</unit:connector>
					<unit:connector var:type="float" var:varname="yactual">
						<var:default var:val="0"/>
					</unit:connector>
					<unit:connector var:type="float" var:varname="phiactual">
						<var:default var:val="0"/>
					</unit:connector>
					<unit:connector var:type="float" var:varname="xset_in">
						<var:default var:val="0"/>
					</unit:connector>
					<unit:connector var:type="float" var:varname="yset_in">
						<var:default var:val="0"/>
					</unit:connector>
					<unit:connector var:type="float" var:varname="phiset_in">
						<var:default var:val="0"/>
					</unit:connector>
				</unit:in>
				<unit:out>
					<unit:connector var:type="float" var:varname="xset">
						<var:default var:val="0"/>
					</unit:connector>
					<unit:connector var:type="float" var:varname="yset">
						<var:default var:val="0"/>
					</unit:connector>
					<unit:connector var:type="float" var:varname="phiset">
						<var:default var:val="0"/>
					</unit:connector>
				</unit:out>
			</unit:connectors>
			<unit:state>
			</unit:state>

			<unit:guiinfo>
				<unit:connectors>
					<unit:in>
						<unit:layout unit:varname="xactual" unit:side="left"/>
						<unit:layout unit:varname="yactual" unit:side="left"/>
						<unit:layout unit:varname="phiactual" unit:side="left"/>
						<unit:layout unit:varname="xset_in" unit:side="left" unit:display="hidden"/>
						<unit:layout unit:varname="yset_in" unit:side="left" unit:display="hidden"/>
						<unit:layout unit:varname="phiset_in" unit:side="left" unit:display="hidden"/>
					</unit:in>
					<unit:out>
						<unit:layout unit:varname="xset" unit:side="right"/>
						<unit:layout unit:varname="yset" unit:side="right"/>
						<unit:layout unit:varname="phiset" unit:side="right"/>
					</unit:out>
				</unit:connectors>
				<unit:state>
				</unit:state>

				<unit:description>
					<unit:name>Position View</unit:name>
					<unit:icon unit:filename="icons/positionview.png"/>
					<unit:connectors>
						<unit:in>
							<unit:info unit:varname="xactual">
								<unit:description>x actual</unit:description>
							</unit:info>
							<unit:info unit:varname="yactual">
								<unit:description>y actual</unit:description>
							</unit:info>
							<unit:info unit:varname="phiactual">
								<unit:description>phi actual</unit:description>
							</unit:info>
							<unit:info unit:varname="xset_in">
								<unit:description>x set in</unit:description>
							</unit:info>
							<unit:info unit:varname="yset_in">
								<unit:description>y set in</unit:description>
							</unit:info>
							<unit:info unit:varname="phiset_in">
								<unit:description>phi set in</unit:description>
							</unit:info>
						</unit:in>
						<unit:out>
							<unit:info unit:varname="xset">
								<unit:description>x set</unit:description>
							</unit:info>
							<unit:info unit:varname="yset">
								<unit:description>y set</unit:description>
							</unit:info>
							<unit:info unit:varname="phiset">
								<unit:description>phi set</unit:description>
							</unit:info>
						</unit:out>
					</unit:connectors>
					<unit:state>
					</unit:state>
				</unit:description>
			</unit:guiinfo>

			<unit:plugins>
				<unit:plugin plugin:type="simulation" plugin:library="unit_robview_navigation_positionview_simulation"/>
				<unit:plugin plugin:type="dialog" plugin:library="unit_robview_navigation_positionview_gui"/>
			</unit:plugins>

			<unit:codegen/>
		</unit:unittype>
	</unit:unittypes>
</unit:unit>

